{
  "description": "Five items in pages of two, then nothing new when resumed.",
  "connector": {"kind": "static", "config": {"page_size": 2, "items": [
    {"key": "item-1", "text": "First item"},
    {"key": "item-2", "text": "Second item", "attachment": "attached notes"},
    {"key": "item-3", "text": "Third item"},
    {"key": "item-4", "text": "Fourth item"},
    {"key": "item-5", "text": "Fifth item"}
  ]}},
  "credential": {"token": "test-token-connector-valid"},
  "expect": {
    "pages": [
      {"record_keys": ["item-1", "item-2"], "more": true},
      {"record_keys": ["item-3", "item-4"], "more": true},
      {"record_keys": ["item-5"], "more": false}
    ],
    "check_credential": {"status": "ok"}
  }
}
